### ISSUE TITLE
System routing not updated for remote subnets

### ISSUE THREAD

**Issue by fourbytes** [dswd/vpncloud.rs#10]
For example if I have 2 nodes with a 10.42.0.0/24 subnet on node1 but the vpncloud ip is 10.42.1.1/32, node2's routing table will not include 10.42.0.0/24.

node2 vpncloud routing table:

```
10.42.1.0/24 dev vpncloud0  proto kernel  scope link  src 10.42.1.21
```

node2 /var/log/vpncloud-net.log:

```
INFO - New peer: node1:3210
INFO - New routing entry: 10.42.1.1/32 => node1:3210
INFO - New routing entry: 10.42.0.0/24 => node1:3210
```

Let me know if I'm missing some here but I would assume vpn routes should automatically be added.

**Comment by fourbytes** [comment]
Temporarily fixed by manually adding route on ifup but doing that on each node gets messy.

**Comment by dswd** [comment]
VpnCloud will completely ignore your interface configuration and not modify it. For your use case that means that you should just configure your interface with 10.42.1.1/16. This will automatically add one route covering the whole subnet 10.42.X.X. The system routing table just needs to send everything via the vpncloud0 interface and VpnCloud will then care about the routing itself.

I covered this case in the manpage: _It is important to configure the interface in a way that all addresses on the VPN can be reached directly. E.g. if addresses 10.0.0.1, 10.0.0.2 and so on are used, the interface needs to be configured as /24. For TUN devices, this means that the prefix length of the subnets must be different than the prefix length that the interface is configured with._

Should I update that text to be clearer? Do you have any suggestions?

**Comment by fourbytes** [comment]
Ah, thanks, my fault for not reading the man page fully, however, might be a bit clearer to specifically cover having different subnets behind each node as that seems like a pretty common case.

**Comment by dswd** [comment]
How about this?

**Comment by fourbytes** [comment]
That's looking good, just another related question (I'm relatively new to networking so this is probably a configuration issue on my part).

I've got 2 nodes, node.foo:
```
device_type: tun
device_name: vpncloud%d
ifup: /etc/vpncloud/four.up.sh
ifdown: /etc/vpncloud/four.down.sh
crypto: aes256
shared_key: "KEY"
peers:
 - node.bar:3210
mode: normal
subnets:
 - 10.42.0.0/24
```

and node.bar:
```
device_type: tun
device_name: vpncloud%d
ifup: /etc/vpncloud/four.up.sh
ifdown: /etc/vpncloud/four.down.sh
crypto: aes256
shared_key: "KEY"
peers: []
mode: normal
subnets: []
```

`node.foo` _doesn't_ have an IP on the vpncloud interface, just on the lan interface. The LAN interface is on `10.42.0.0/24`. Now my understanding is that `node.foo` should tell the other nodes that the `10.42.0.0/24` subnet is behind it, and then vpncloud should route the packets appropriately for that subnet.
`node.bar` has an IP on the vpncloud interface in the `10.42.1.0/24` subnet.

Through this setup, `node.bar` can only ping `node.foo`'s IP, but nothing else on `node.foo`'s subnet. I've figured out I can fix this by adding a route defining the gateway for `node.foo`'s subnet as `node.foo`  (`ip route add 10.42.0.0/24 via 10.42.0.12`) but it's my understanding that vpncloud should be routing packets these packets itself since `node.foo` is broadcasting it has the `10.42.0.0/24` subnet.

`four.up.sh` just sets the MTU, brings up the interface and sets the interface IP with a /16 prefix length so all 10.42.x packets are routed to vpncloud.

As I said, more than likely a configuration issue on my part but would be great if you know what's happening here.

**Comment by dswd** [comment]
Ok this setup has some problems. 
1) Your not setting any subnet for `node.bar`, this is wrong. I have no idea why you are able to get it working. `node.foo` should not be able to deliver the ping reply as `10.42.1.0` is not claimed by any node. In routing mode it should also not broadcast and just drop the reply. It would be interresting to know how this works.
2) Not setting an IP on the vpncloud interface for `node.foo` also seems wrong as the node then has no route via that interface.

If you want to be able to dial into a network e.g. `10.42.0.0/16` via TUN you could try the following setup:
- Define a client subnet e.g. `10.42.254.1/24` that is not used so far 
- Setup the interface on `node.bar` with an IP from the client network and a netmask of the whole network `10.42.254.1/16`, no special routes needed
- Give `node.bar` its own tiny `10.42.254.1/32` subnet
- Setup the interface on `node.foo` with an IP in the client subnet and the netmask of the client subnet e.g. `10.42.254.254/24`, no special routes
- Let `node.foo` claim the whole network as subnet `10.42.0.0/16`. The more specific `/32` client subnets will take precendence
- Instruct all nodes at `node.foo`s location to route towards the client network via your gateway `node.foo` e.g. `route add 10.42.254.0/24 via 10.42.0.12`

**Comment by fourbytes** [comment]
Alright, I've updated my setup to include all your suggestions (I think), but still doesn't seem to be working.

node.foo:
```
device_type: tun
device_name: vpncloud%d
ifup: /etc/vpncloud/four.up.sh
ifdown: /etc/vpncloud/four.down.sh
crypto: aes256
shared_key: "KEY"
port: 3210
peers:
 - central.fourbytes.me:3210
peer_timeout: 1800
mode: normal
subnets:
 - 10.42.1.11/32
 - 10.42.0.0/16
```

node.bar:
```
device_type: tun
device_name: vpncloud%d
ifup: /etc/vpncloud/four.up.sh
ifdown: /etc/vpncloud/four.down.sh
crypto: aes256
shared_key: "KEY"
port: 3210
peers: []
peer_timeout: 1800
mode: normal
subnets:
 - 10.42.1.21/32
 - 10.42.1.41/32
```

node.bar has another machine behind it which is why it's got two tiny subnets.

What I can do:
- Ping any of the nodes from any of the other nodes.
- Ping the gateway's vpncloud IP from anything behind that node (so the route is setup correctly).

What I can't do:
- Ping any of the nodes on the vpn subnet other than node.foo from behind it.

Traceroute from a node behind node.foo to node.bar:
```
traceroute to 10.42.1.21 (10.42.1.21), 64 hops max, 52 byte packets
 1  fw (10.42.0.1)  1.769 ms  0.961 ms  0.898 ms
 2  node.foo (10.42.0.12)  1.133 ms  1.080 ms  1.063 ms
 3  * * *
 ...
```

Traceroute from node.bar to a node behind node.foo:
```
root@bar:~# traceroute 10.42.0.120
traceroute to 10.42.0.120 (10.42.0.120), 30 hops max, 60 byte packets
 1  10.42.1.21 (10.42.1.21)  2997.061 ms !H  2996.901 ms !H  2996.899 ms !H
```

node.bar routes:
```
default via (public ip) dev ens3
10.42.0.0/16 dev vpncloud0  proto kernel  scope link  src 10.42.1.21
(public ip routes)
```

node.foo routes:
```
default via 10.42.0.1 dev eth0
10.42.0.0/24 dev eth0  proto kernel  scope link  src 10.42.0.12
10.42.1.0/24 dev vpncloud0  proto kernel  scope link  src 10.42.1.11
172.17.0.0/16 dev docker0  proto kernel  scope link  src 172.17.0.1
```

**Comment by fourbytes** [comment]
I've also tried to bypass the router in front of node.foo by adding a custom route to the machine behind it but still no go so isn't an issue with the router.

**Comment by dswd** [comment]
Did you enable ip-forwarding on `node.foo`? If not: `sysctl -w net.ipv4.ip_forward=1`

Permanent with: `echo "net.ipv4.ip_forward = 1" >> /etc/sysctl.conf`

**Comment by fourbytes** [comment]
Yep, ip forwarding is enabled on both nodes:
```
root@node.foo:~# sysctl net.ipv4.ip_forward
net.ipv4.ip_forward = 1
```

**Comment by dswd** [comment]
Ok now I don't see what is wrong with that. Can you try to observe the ping with `tcpdump` and check where it gets lost?
This scenario definitely deserves a tutorial...

**Comment by fourbytes** [comment]
tcpdump on node.bar shows that icmp packets are being received:
```
root@bar:~# tcpdump -i vpncloud0 src host 10.42.0.9
tcpdump: verbose output suppressed, use -v or -vv for full protocol decode
listening on vpncloud0, link-type EN10MB (Ethernet), capture size 262144 bytes
07:40:10.164643 IP 10.42.0.9 > 10.42.1.21: ICMP echo request, id 31865, seq 75, length 64
07:40:11.159905 IP 10.42.0.9 > 10.42.1.21: ICMP echo request, id 31865, seq 76, length 64
```

```
root@bar:~# tcpdump -i vpncloud0 dst host 10.42.0.9
tcpdump: verbose output suppressed, use -v or -vv for full protocol decode
listening on vpncloud0, link-type EN10MB (Ethernet), capture size 262144 bytes
07:41:39.003134 ARP, Request who-has 10.42.0.9 tell 10.42.1.21, length 28
07:41:40.000999 ARP, Request who-has 10.42.0.9 tell 10.42.1.21, length 28
```

`foo` also receives those arp requests from `bar` but doesn't seem to respond, only packets outgoing to `bar` are the icmp echo requests.
```
root@foo:~# tcpdump -i vpncloud0 dst host 10.42.0.9
tcpdump: verbose output suppressed, use -v or -vv for full protocol decode
listening on vpncloud0, link-type EN10MB (Ethernet), capture size 262144 bytes
17:43:41.684309 ARP, Request who-has 10.42.0.9 tell 10.42.1.21, length 28
17:43:42.684468 ARP, Request who-has 10.42.0.9 tell 10.42.1.21, length 28
```

**Comment by dswd** [comment]
Ok that is very strange. You should not see ARP packets on a TUN interface. Can you verify that the interface really is TUN? You should see `Link encap:UNSPEC` and `POINTOPOINT NOARP` in `ifconfig`.

**Comment by dswd** [comment]
Ok I found an error in the argument parsing that made it ignore your TUN setting. That explains it all: Your subnets were ignored completely, you had a normal learning switch.

**Comment by fourbytes** [comment]
Thereee we go, working perfectly now.

**Comment by dswd** [comment]
Just for the record, this case is now covered in a [tutorial](https://github.com/dswd/vpncloud.rs/wiki/Dial-in-Tutorial)
